id,title,overview,popularity,vote_average,genres,combined_features
155,The Dark Knight,"Batman raises the stakes in his war on crime. With the help of Lt. Jim Gordon and District Attorney Harvey Dent, Batman sets out to dismantle the remaining criminal organizations that plague the streets.",130.4,8.5,Drama Action Crime Thriller,"the dark knight batman raises the stakes in his war on crime. with the help of lt. jim gordon and district attorney harvey dent, batman sets out to dismantle the remaining criminal organizations that plague the streets. drama action crime thriller"
27205,Inception,"Cobb, a skilled thief who commits corporate espionage by infiltrating the subconscious of his targets is offered a chance to regain his old life as payment for a task considered to be impossible: ""inception"", the implantation of another person's idea into a target's subconscious.",150.2,8.4,Action Science Fiction Adventure,"inception cobb, a skilled thief who commits corporate espionage by infiltrating the subconscious of his targets is offered a chance to regain his old life as payment for a task considered to be impossible: ""inception"", the implantation of another person's idea into a target's subconscious. action science fiction adventure"
157336,Interstellar,"The adventures of a group of explorers who make use of a newly discovered wormhole to surpass the limitations on human space travel and conquer the vast distances involved in an interstellar voyage.",180.5,8.4,Adventure Drama Science Fiction,"interstellar the adventures of a group of explorers who make use of a newly discovered wormhole to surpass the limitations on human space travel and conquer the vast distances involved in an interstellar voyage. adventure drama science fiction"
603,The Matrix,"Set in the 22nd century, The Matrix tells the story of a computer hacker who joins a group of underground insurgents fighting the vast and powerful computers who now rule the earth.",110.1,8.2,Action Science Fiction,"the matrix set in the 22nd century, the matrix tells the story of a computer hacker who joins a group of underground insurgents fighting the vast and powerful computers who now rule the earth. action science fiction"
122,The Lord of the Rings: The Return of the King,"Aragorn is revealed as the heir to the ancient kings as he, Gandalf and the other members of the broken fellowship struggle to save Gondor from Sauron's forces. Meanwhile, Frodo and Sam take the ring closer to the heart of Mordor, the dark lord's realm.",140.2,8.5,Adventure Fantasy Action,"the lord of the rings: the return of the king aragorn is revealed as the heir to the ancient kings as he, gandalf and the other members of the broken fellowship struggle to save gondor from sauron's forces. meanwhile, frodo and sam take the ring closer to the heart of mordor, the dark lord's realm. adventure fantasy action"
278,The Shawshank Redemption,"Framed in the 1940s for the double murder of his wife and her lover, upstanding banker Andy Dufresne begins a new life at the Shawshank prison, where he puts his accounting skills to work for an amoral warden. During his long stretch in prison, Dufresne comes to be admired by the other inmates -- including an older prisoner named Red -- for his integrity and unquenchable sense of hope.",135.5,8.7,Drama Crime,"the shawshank redemption framed in the 1940s for the double murder of his wife and her lover, upstanding banker andy dufresne begins a new life at the shawshank prison, where he puts his accounting skills to work for an amoral warden. during his long stretch in prison, dufresne comes to be admired by the other inmates -- including an older prisoner named red -- for his integrity and unquenchable sense of hope. drama crime"
13,Forrest Gump,"A man with a low IQ has accomplished great things in his life and been present during significant historic events—in each case, far exceeding what anyone imagined he could do. But despite all he has achieved, his one true love eludes him.",120.3,8.5,Comedy Drama Romance,"forrest gump a man with a low iq has accomplished great things in his life and been present during significant historic events—in each case, far exceeding what anyone imagined he could do. but despite all he has achieved, his one true love eludes him. comedy drama romance"
